request_id,title,search_keyword,target_sites,ebay_price_jpy,ebay_url
301,KTM PowerWear Hoodie Men’s XL Full Zip Jacket Dirtbike Motorcycle Motorsports,KTM PowerWear パーカー Men’s XL Full Zip ジャケット Dirtbike Motorcycle Motorsports,mercari;yahoo,4645,https://www.ebay.com/itm/267334417820?_skw=KTM+PowerWear&hash=item3e3e5f7d9c:g:BaEAAeSwlEZoet9j
302,KTM PowerWear Team V6 Thermo Water Bottle - Black Motocross Mx BMx,KTM PowerWear Team V6 Thermo Water Bottle - Black Motocross Mx BMx,mercari;yahoo,4958,https://www.ebay.com/itm/257425215694?_skw=KTM+PowerWear&hash=item3befbd10ce:g:YSIAAeSwsr5pxGDc
303,"KTM PowerWear 2025 Orange Fluids T-Shirt - Black, Small KPW1XIR-X001-Y002","KTM PowerWear 2025 Orange Fluids Tシャツ - Black, Small KPW1XIR-X001-Y002",mercari;yahoo,4129,https://www.ebay.com/itm/298389818497?_skw=KTM+PowerWear&hash=item45796b4c81:g:3ZMAAeSwsD9qI~YS
304,KTM PowerWear 2025 Kini-RB Competition Pants,KTM PowerWear 2025 Kini-RB Competition パンツ,mercari;yahoo,25573,https://www.ebay.com/itm/306951513638?_skw=KTM+PowerWear&hash=item4777bc6626:g:~jIAAeSwFG1qDjaG
305,"KTM PowerWear 2025 Kini-RedBull Competition Jersey Blue/White, XL - 3KI250028905","KTM PowerWear 2025 Kini-RedBull Competition Jersey Blue/White, XL - 3KI250028905",mercari;yahoo,8988,https://www.ebay.com/itm/178027829712?_skw=KTM+PowerWear&hash=item29734919d0:g:pKAAAeSw2Rtp08f1
306,KTM PowerWear WP Team Hardshell Jacket,KTM PowerWear WP Team Hardshell ジャケット,mercari;yahoo,30533,https://www.ebay.com/itm/306958074815?_skw=KTM+PowerWear&hash=item47782083bf:g:~SAAAeSwcSpqEibR
307,KTM PowerWear 2025 Gravity FX Air Jersey,KTM PowerWear 2025 Gravity FX Air Jersey,mercari;yahoo,9213,https://www.ebay.com/itm/298068042476?_skw=KTM+PowerWear&hash=item45663d62ec:g:cFMAAeSwF95poBmq
308,KTM Powerwear Radical X V2 Gloves Motorcycle Riding Gear Small/8 - 3PW220001102,KTM Powerwear Radical X V2 グローブ Motorcycle Riding Gear Small/8 - 3PW220001102,mercari;yahoo,13948,https://www.ebay.com/itm/318163802009?_skw=KTM+PowerWear&hash=item4a140a5799:g:LR0AAeSwPIZp4oB1
309,KTM PowerWear 2024 Team Sandals,KTM PowerWear 2024 Team Sandals,mercari;yahoo,3652,https://www.ebay.com/itm/306958933590?_skw=KTM+PowerWear&hash=item47782d9e56:g:IuQAAeSwZQpqEs4G
310,KTM PowerWear WP Team T-Shirt sz Large Motocross MX BMX new! Free shipping!,KTM PowerWear WP Team Tシャツ sz Large Motocross MX BMX new! Free shipping!,mercari;yahoo,5268,https://www.ebay.com/itm/257392740532?_skw=KTM+PowerWear&hash=item3bedcd88b4:g:KQcAAeSwI0FpqgFB
311,KTM PowerWear Alpinestars S-MX6 V2 Boots,KTM PowerWear Alpinestars S-MX6 V2 ブーツ,mercari;yahoo,52853,https://www.ebay.com/itm/298347068029?_skw=KTM+PowerWear&hash=item4576defa7d:g:M28AAeSwK4lqEibS
312,KTM PowerWear WP Team Polo Shirt sz Large Motocross MX BMX NEW!! Free Shipping!!,KTM PowerWear WP Team Polo シャツ sz Large Motocross MX BMX NEW!! Free Shipping!!,mercari;yahoo,8523,https://www.ebay.com/itm/257392747672?_skw=KTM+PowerWear&hash=item3bedcda498:g:e9gAAeSw3VtpqgPN
313,KTM PowerWear Racetech K-Hydratech Gloves,KTM PowerWear Racetech K-Hydratech グローブ,mercari;yahoo,7783,https://www.ebay.com/itm/298323093554?_skw=KTM+PowerWear&hash=item4575712832:g:ia0AAeSwcSpqCEL4
314,KTM PowerWear Performance Summer 3/4 Baselayer Pants,KTM PowerWear Performance Summer 3/4 Baselayer パンツ,mercari;yahoo,10166,https://www.ebay.com/itm/306965394366?_skw=KTM+PowerWear&hash=item47789033be:g:nC0AAeSwI3ZqFsBv
315,KTM PowerWear Replica STACYC 20eDrive Stability Cycle UPW220074900,KTM PowerWear Replica STACYC 20eDrive Stability Cycle UPW220074900,mercari;yahoo,232345,https://www.ebay.com/itm/306875362363?_skw=KTM+PowerWear&hash=item4773326c3b:g:AjkAAeSwzp1p2sTN
316,KTM PowerWear Breeze Pants Small/30 (3pw240008602),KTM PowerWear Breeze パンツ Small/30 (3pw240008602),mercari;yahoo,14568,https://www.ebay.com/itm/236506183192?_skw=KTM+PowerWear&hash=item3710ddf618:g:OwYAAeSw1MxpMLLk
317,KTM PowerWear Tourrain V3 Waterproof Jacket,KTM PowerWear Tourrain V3 Waterproof ジャケット,mercari;yahoo,44793,https://www.ebay.com/itm/306955894095?_skw=KTM+PowerWear&hash=item4777ff3d4f:g:ExAAAeSwldpqENKk
318,KTM PowerWear 2024 Team T-Shirt sz Large Motocross Mx BMX,KTM PowerWear 2024 Team Tシャツ sz Large Motocross Mx BMX,mercari;yahoo,5268,https://www.ebay.com/itm/257434154022?_skw=KTM+PowerWear&hash=item3bf0457426:g:whsAAeSwcdJpyvsw
319,KTM PowerWear Kid's Hero Set KPW1XJ9,KTM PowerWear Kid's Hero Set KPW1XJ9,mercari;yahoo,6989,https://www.ebay.com/itm/298389793980?_skw=KTM+PowerWear&hash=item45796aecbc:g:69MAAeSwbc1qI~J3
320,"KTM PowerWear Alpinestars Sequence Chest Protector - Black, X-Small/Small","KTM PowerWear Alpinestars Sequence Chest Protector - Black, X-Small/Small",mercari;yahoo,30688,https://www.ebay.com/itm/306933944743?_skw=KTM+PowerWear&hash=item4776b051a7:g:bWEAAeSw7aZqAvqP
321,KTM PowerWear WP Team Zip Hoody sz Large Motocross MX BMX NEW!! Free Shipping!!,KTM PowerWear WP Team Zip Hoody sz Large Motocross MX BMX NEW!! Free Shipping!!,mercari;yahoo,11623,https://www.ebay.com/itm/257392753790?_skw=KTM+PowerWear&hash=item3bedcdbc7e:g:AZUAAeSwMcVpqgSs
322,KTM Powerwear Adv R V2 Adventure Motorcycle Riding Jacket 2XL - 3PW220003006,KTM Powerwear Adv R V2 Adventure Motorcycle Riding ジャケット 2XL - 3PW220003006,mercari;yahoo,27898,https://www.ebay.com/itm/206216455699?_skw=KTM+PowerWear&hash=item3003756613:g:HwsAAeSw7aZp4ncG
323,KTM PowerWear Alpinestars Youth Bionic Plus Protection Jacket,KTM PowerWear Alpinestars Youth Bionic Plus Protection ジャケット,mercari;yahoo,32238,https://www.ebay.com/itm/306947150111?_skw=KTM+PowerWear&hash=item477779d11f:g:H-gAAeSwQdhqC4wT
324,KTM PowerWear 2024 Mechanic Shirt,KTM PowerWear 2024 Mechanic シャツ,mercari;yahoo,8736,https://www.ebay.com/itm/298389795795?_skw=KTM+PowerWear&hash=item45796af3d3:g:7ZsAAeSw2r9qI~M7
325,KTM PowerWear Pure Softshell Jacket sz Large Motocross MX BMX Free Shipping!!,KTM PowerWear Pure Softshell ジャケット sz Large Motocross MX BMX Free Shipping!!,mercari;yahoo,14568,https://www.ebay.com/itm/257392738514?_skw=KTM+PowerWear&hash=item3bedcd80d2:g:-ScAAeSwGBBpqgAs
326,KTM PowerWear 2024 Red Bull Team Shorts,KTM PowerWear 2024 Red Bull Team Shorts,mercari;yahoo,12867,https://www.ebay.com/itm/298389818722?_skw=KTM+PowerWear&hash=item45796b4d62:g:VJcAAeSwOS1qI~Ye
327,KTM PowerWear 2024 Women's Team Softshell Jacket,KTM PowerWear 2024 Women's Team Softshell ジャケット,mercari;yahoo,16118,https://www.ebay.com/itm/306975792122?_skw=KTM+PowerWear&hash=item47792edbfa:g:L10AAeSw9f1qHVmb
328,"KTM PowerWear Offroad T-Shirt - Black, X-Small KPW1XJE-X001-Y001","KTM PowerWear Offroad Tシャツ - Black, X-Small KPW1XJE-X001-Y001",mercari;yahoo,4765,https://www.ebay.com/itm/298389815299?_skw=KTM+PowerWear&hash=item45796b4003:g:SakAAeSwuJJqI~SR
329,KTM PowerWear Ogio Pure No Drag Backpack - Black/Orange 3PW240030700,KTM PowerWear Ogio Pure No Drag Backpack - Black/Orange 3PW240030700,mercari;yahoo,35803,https://www.ebay.com/itm/298347064649?_skw=KTM+PowerWear&hash=item4576deed49:g:UygAAeSwHpNqEiYC
330,KTM PowerWear Street Evo V3 Jacket,KTM PowerWear Street Evo V3 ジャケット,mercari;yahoo,44793,https://www.ebay.com/itm/298361399400?_skw=KTM+PowerWear&hash=item4577b9a868:g:f9EAAeSwlRRqGBOr
331,KTM PowerWear 2024 Team T-Shirt,KTM PowerWear 2024 Team Tシャツ,mercari;yahoo,5558,https://www.ebay.com/itm/298348488294?_skw=KTM+PowerWear&hash=item4576f4a666:g:UewAAeSwXbZqEs37
332,KTM PowerWear 2024 Ogio Red Bull Team Dakar Hydration Backpack - Navy/Orange,KTM PowerWear 2024 Ogio Red Bull Team Dakar Hydration Backpack - Navy/Orange,mercari;yahoo,26348,https://www.ebay.com/itm/306929337298?_skw=KTM+PowerWear&hash=item47766a03d2:g:x6kAAeSw0lVp~~sY
333,KTM PowerWear WP Team Shorts,KTM PowerWear WP Team Shorts,mercari;yahoo,12073,https://www.ebay.com/itm/306958074611?_skw=KTM+PowerWear&hash=item47782082f3:g:ZygAAeSwwilqEicE
334,KTM PowerWear Alpinestars Youth SX-1 Knee Guards,KTM PowerWear Alpinestars Youth SX-1 Knee Guards,mercari;yahoo,18753,https://www.ebay.com/itm/306928930506?_skw=KTM+PowerWear&hash=item477663ceca:g:MWkAAeSwNylp~66T
335,KTM PowerWear Gravity-FX Gloves MX Motocross Riding Gear S/8 3PW210029102 New,KTM PowerWear Gravity-FX グローブ MX Motocross Riding Gear S/8 3PW210029102 New,mercari;yahoo,5423,https://www.ebay.com/itm/206212386814?_skw=KTM+PowerWear&hash=item3003374ffe:g:VgkAAeSw26hp37n9
336,KTM PowerWear Alpinestars SMX-6 V2 Gore-Tex Boots,KTM PowerWear Alpinestars SMX-6 V2 Gore-Tex ブーツ,mercari;yahoo,62153,https://www.ebay.com/itm/306963133139?_skw=KTM+PowerWear&hash=item47786db2d3:g:uygAAeSwXSNqFW-y
337,KTM PowerWear Pure Softshell Jacket,KTM PowerWear Pure Softshell ジャケット,mercari;yahoo,16118,https://www.ebay.com/itm/306837449623?_skw=KTM+PowerWear&hash=item4770efeb97:g:i~IAAeSwCnlpwGu9
338,KTM Powerwear Hooded Softshell Racing Jacket Black Orange Geometric Men Size S,KTM Powerwear Hooded Softshell Racing ジャケット Black Orange Geometric Men Size S,mercari;yahoo,7747,https://www.ebay.com/itm/267682626509?_skw=KTM+PowerWear&hash=item3e5320bbcd:g:1DEAAeSwAllqF54c
339,Casual Racing Shoe KTM PowerWear,Casual Racing Shoe KTM PowerWear,mercari;yahoo,5425,https://www.ebay.com/itm/127346418308?_skw=KTM+PowerWear&hash=item1da6702284:g:gSwAAeSwalJotmuT
340,KTM PowerWear Ultra V2 WP Gloves Size L/10 Leather Knuckle Guard 3PW230003104,KTM PowerWear Ultra V2 WP グローブ Size L/10 Leather Knuckle Guard 3PW230003104,mercari;yahoo,10848,https://www.ebay.com/itm/178104304362?_skw=KTM+PowerWear&hash=item2977d802ea:g:GmwAAeSwcnFp-KNM
341,KTM PowerWear Baby Body Set,KTM PowerWear Baby Body Set,mercari;yahoo,6512,https://www.ebay.com/itm/298380434247?_skw=KTM+PowerWear&hash=item4578dc1b47:g:AUwAAeSw0LZqH~uz
342,KTM PowerWear 2024 Women's Team T-Shirt,KTM PowerWear 2024 Women's Team Tシャツ,mercari;yahoo,5558,https://www.ebay.com/itm/306979944837?_skw=KTM+PowerWear&hash=item47796e3985:g:EMgAAeSwOgJqH~sF
343,KTM PowerWear Women's Logo T-Shirt,KTM PowerWear Women's Logo Tシャツ,mercari;yahoo,4765,https://www.ebay.com/itm/298383767790?_skw=KTM+PowerWear&hash=item45790ef8ee:g:~YEAAeSwiiVqIVBD
344,KTM PowerWear 2025 Racetech Pro Jersey,KTM PowerWear 2025 Racetech Pro Jersey,mercari;yahoo,15033,https://www.ebay.com/itm/306962166227?_skw=KTM+PowerWear&hash=item47785ef1d3:g:CAoAAeSw0rNqFMkd
345,KTM PowerWear 2024 Team Half-Zip Sweatshirt Large Motocross MX BMX,KTM PowerWear 2024 Team Half-Zip Sweatshirt Large Motocross MX BMX,mercari;yahoo,11003,https://www.ebay.com/itm/257434057269?_skw=KTM+PowerWear&hash=item3bf043fa35:g:QusAAeSwEhNpyujI
346,KTM PowerWear Performance Summer 3/4 Baselayer Pants sz Large Motocross Mx  BMX,KTM PowerWear Performance Summer 3/4 Baselayer パンツ sz Large Motocross Mx BMX,mercari;yahoo,9453,https://www.ebay.com/itm/257425240329?_skw=KTM+PowerWear&hash=item3befbd7109:g:SuwAAeSwk2dpxGW2
347,KTM PowerWear Racetech Crew Socks - Black 3PW250052700,KTM PowerWear Racetech Crew Socks - Black 3PW250052700,mercari;yahoo,2381,https://www.ebay.com/itm/306963133544?_skw=KTM+PowerWear&hash=item47786db468:g:UBwAAeSwZeRqFW8R
348,KTM PowerWear Terra Adventure Pro Jacket Sz Large Motocross MX BMX Motorcycle,KTM PowerWear Terra Adventure Pro ジャケット Sz Large Motocross MX BMX Motorcycle,mercari;yahoo,55798,https://www.ebay.com/itm/256863749708?_skw=KTM+PowerWear&hash=item3bce45c64c:g:Kh4AAeSw1Ptn2zoX
349,KTM PowerWear 2024 Red Bull Team Vest,KTM PowerWear 2024 Red Bull Team Vest,mercari;yahoo,13820,https://www.ebay.com/itm/298389766483?_skw=KTM+PowerWear&hash=item45796a8153:g:2v4AAeSw-QBqI~Br
350,KTM PowerWear Transparent Rain Jacket Sz S Lightweight Moto Racing Windbreaker,KTM PowerWear Transparent Rain ジャケット Sz S Lightweight Moto Racing Windbreaker,mercari;yahoo,7580,https://www.ebay.com/itm/317447198374?_skw=KTM+PowerWear&hash=item49e953d6a6:g:HR4AAeSwe91og-7x
351,KTM PowerWear Rubber Logo Keyholder,KTM PowerWear Rubber Logo Keyholder,mercari;yahoo,1745,https://www.ebay.com/itm/306940346583?_skw=KTM+PowerWear&hash=item47771200d7:g:PPkAAeSw4ABqBvMe
352,KTM Racing Powerwear LS Thermal Shirt Size XL Skull Graphic Design Motorcycle,KTM Racing Powerwear LS Thermal シャツ Size XL Skull Graphic Design Motorcycle,mercari;yahoo,2323,https://www.ebay.com/itm/287351069003?_skw=KTM+PowerWear&hash=item42e775594b:g:l8UAAOSwBK1nfC8A
353,KTM PowerWear Pure Ogio Covert Backpack - Black/Orange 3PW240031000,KTM PowerWear Pure Ogio Covert Backpack - Black/Orange 3PW240031000,mercari;yahoo,18908,https://www.ebay.com/itm/306939691852?_skw=KTM+PowerWear&hash=item477708034c:g:8T8AAeSwn75qBpKG
354,KTM PowerWear Street Evo K-Hydrotech Gloves,KTM PowerWear Street Evo K-Hydrotech グローブ,mercari;yahoo,12391,https://www.ebay.com/itm/298347097573?_skw=KTM+PowerWear&hash=item4576df6de5:g:62oAAeSwLQ1qEinn
355,KTM PowerWear 2024 Team Pants,KTM PowerWear 2024 Team パンツ,mercari;yahoo,13820,https://www.ebay.com/itm/306958110771?_skw=KTM+PowerWear&hash=item4778211033:g:evAAAeSwn8tqEivd
356,KTM PowerWear 2024 Gravity FX Replica Pants,KTM PowerWear 2024 Gravity FX Replica パンツ,mercari;yahoo,26968,https://www.ebay.com/itm/298354849444?_skw=KTM+PowerWear&hash=item457755b6a4:g:61QAAeSwY5xqFW~~
357,KTM PowerWear Speed Tourer K-Hydratech Pro Jacket KPW1XJP,KTM PowerWear Speed Tourer K-Hydratech Pro ジャケット KPW1XJP,mercari;yahoo,79203,https://www.ebay.com/itm/306986008706?_skw=KTM+PowerWear&hash=item4779cac082:g:C6kAAeSw-LRqI~M4
358,KTM Powerwear Moto Road Jacket Men’s L,KTM Powerwear Moto Road ジャケット Men’s L,mercari;yahoo,19375,https://www.ebay.com/itm/336546887774?_skw=KTM+PowerWear&hash=item4e5bc1f85e:g:dzgAAeSwUv5p6RMs
359,KTM PowerWear Red Bull Team Beanie - Navy/Orange Motocross Mx BmX,KTM PowerWear Red Bull Team Beanie - Navy/Orange Motocross Mx BmX,mercari;yahoo,5733,https://www.ebay.com/itm/257425231432?_skw=KTM+PowerWear&hash=item3befbd4e48:g:dNwAAeSwY8FpxGMa
360,KTM PowerWear 2025 Red Bull KTM Grid Beanie - Navy/Orange 3RB250039900,KTM PowerWear 2025 Red Bull KTM Grid Beanie - Navy/Orange 3RB250039900,mercari;yahoo,5558,https://www.ebay.com/itm/298398974983?_skw=KTM+PowerWear&hash=item4579f70407:g:-uYAAeSw~nRqJ-WN
361,"KTM PowerWear 2024 Team Hardshell Jacket-Black/Orange, Large Motocross MX BMX","KTM PowerWear 2024 Team Hardshell Jacket-Black/Orange, Large Motocross MX BMX",mercari;yahoo,29448,https://www.ebay.com/itm/257434060332?_skw=KTM+PowerWear&hash=item3bf044062c:g:DBoAAeSwkXVpyumu
362,KTM PowerWear Racetech K-Hydratech Pro Jacket,KTM PowerWear Racetech K-Hydratech Pro ジャケット,mercari;yahoo,45103,https://www.ebay.com/itm/306891904074?_skw=KTM+PowerWear&hash=item47742ed44a:g:SDEAAeSwZqJp5fws
363,KTM PowerWear 2024 Gravity FX Motocross Jacket Large Brand new! Free shipping!,KTM PowerWear 2024 Gravity FX Motocross ジャケット Large Brand new! Free shipping!,mercari;yahoo,18598,https://www.ebay.com/itm/257295404546?_skw=KTM+PowerWear&hash=item3be8004e02:g:0XAAAeSwpvZpXH93
364,KTM PowerWear Ultra V2 WP Gloves Size L/10 Leather Knuckle Guard 3PW230003104,KTM PowerWear Ultra V2 WP グローブ Size L/10 Leather Knuckle Guard 3PW230003104,mercari;yahoo,10848,https://www.ebay.com/itm/178104391660?_skw=KTM+PowerWear&hash=item2977d957ec:g:CjgAAeSwntxp-K0d
365,KTM PowerWear Two 4 Ride V3 Jacket,KTM PowerWear Two 4 Ride V3 ジャケット,mercari;yahoo,28053,https://www.ebay.com/itm/298045010844?_skw=KTM+PowerWear&hash=item4564ddf39c:g:wiUAAeSw8ptpljf5
366,KTM PowerWear Kid's Red Bull Team Zip Hoody,KTM PowerWear Kid's Red Bull Team Zip Hoody,mercari;yahoo,12549,https://www.ebay.com/itm/306868339658?_skw=KTM+PowerWear&hash=item4772c743ca:g:0MUAAeSwZU5p1irB
367,KTM PowerWear 2025 Red Bull KTM Dusk Bomber Jacket,KTM PowerWear 2025 Red Bull KTM Dusk Bomber ジャケット,mercari;yahoo,13979,https://www.ebay.com/itm/298347097296?_skw=KTM+PowerWear&hash=item4576df6cd0:g:KqoAAeSwGgVqEioh
368,KTM PowerWear ADV S GORE-TEX Gloves - Waterproof Medium / 9 - 3PW240009003,KTM PowerWear ADV S GORE-TEX グローブ - Waterproof Medium / 9 - 3PW240009003,mercari;yahoo,22473,https://www.ebay.com/itm/177422254047?_skw=KTM+PowerWear&hash=item294f30bfdf:g:vjoAAeSwKeRpwZ9-
369,KTM PowerWear ADV S GORE-TEX Gloves - Waterproof Small / 8  - 3PW240009002,KTM PowerWear ADV S GORE-TEX グローブ - Waterproof Small / 8 - 3PW240009002,mercari;yahoo,22473,https://www.ebay.com/itm/318216079081?_skw=KTM+PowerWear&hash=item4a172806e9:g:YlYAAeSwDeVp8L7E
370,KTM PowerWear Shifter Crew Socks - Black 3PW250052800,KTM PowerWear Shifter Crew Socks - Black 3PW250052800,mercari;yahoo,2381,https://www.ebay.com/itm/298351543619?_skw=KTM+PowerWear&hash=item4577234543:g:OAcAAeSw0lVqFB-D
371,KTM PowerWear 2024 Red Bull Team Ogio Rev Backpack - Navy/Orange 3RB240001900,KTM PowerWear 2024 Red Bull Team Ogio Rev Backpack - Navy/Orange 3RB240001900,mercari;yahoo,22938,https://www.ebay.com/itm/298383781085?_skw=KTM+PowerWear&hash=item45790f2cdd:g:PYYAAeSwQvFqIVHZ
372,KTM PowerWear 2025 Kid's Red Bull Team Hat - Orange/Blue 3RB240002900,KTM PowerWear 2025 Kid's Red Bull Team 帽子 - Orange/Blue 3RB240002900,mercari;yahoo,4765,https://www.ebay.com/itm/298370765981?_skw=KTM+PowerWear&hash=item457848949d:g:QjYAAeSwvfRqHAhq
373,KTM PowerWear Intake Crew Socks - Black 3PW250052900,KTM PowerWear Intake Crew Socks - Black 3PW250052900,mercari;yahoo,2381,https://www.ebay.com/itm/306966653350?_skw=KTM+PowerWear&hash=item4778a369a6:g:wYgAAeSw01lqF2nk
374,KTM PowerWear 2025 Two 4 Ride V3 Gloves,KTM PowerWear 2025 Two 4 Ride V3 グローブ,mercari;yahoo,6512,https://www.ebay.com/itm/306882960241?_skw=KTM+PowerWear&hash=item4773a65b71:g:Bi8AAeSw7LFp4Aju
375,KTM PowerWear 2024 Red Bull Team Polo,KTM PowerWear 2024 Red Bull Team Polo,mercari;yahoo,10166,https://www.ebay.com/itm/306978011512?_skw=KTM+PowerWear&hash=item477950b978:g:X7EAAeSwEDtqHqpQ
376,KTM PowerWear 2025 Red Bull KTM Dusk Sweat Shirt,KTM PowerWear 2025 Red Bull KTM Dusk Sweat シャツ,mercari;yahoo,11913,https://www.ebay.com/itm/298351543346?_skw=KTM+PowerWear&hash=item4577234432:g:sigAAeSw0rNqFB~x
377,KTM PowerWear 2025 Youth Gravity FX Jersey,KTM PowerWear 2025 Youth Gravity FX Jersey,mercari;yahoo,6353,https://www.ebay.com/itm/306958074979?_skw=KTM+PowerWear&hash=item4778208463:g:wToAAeSwRZlqEiZc
378,KTM PowerWear 2024 Women's Red Bull Team T-Shirt,KTM PowerWear 2024 Women's Red Bull Team Tシャツ,mercari;yahoo,6512,https://www.ebay.com/itm/306971837035?_skw=KTM+PowerWear&hash=item4778f2826b:g:DuwAAeSw1XFqGrdJ
379,KTM Powerwear Adv R V2 Adventure Motorcycle Riding Jacket  M - 3PW220003003,KTM Powerwear Adv R V2 Adventure Motorcycle Riding ジャケット M - 3PW220003003,mercari;yahoo,27344,https://www.ebay.com/itm/317159071605?_skw=KTM+PowerWear&hash=item49d8275f75:g:zX4AAeSwrw5pwZ9h
380,KTM PowerWear WP Team Hardshell Jacket sz Large NEW!! Motocross! Free shipping!,KTM PowerWear WP Team Hardshell ジャケット sz Large NEW!! Motocross! Free shipping!,mercari;yahoo,28673,https://www.ebay.com/itm/257392756041?_skw=KTM+PowerWear&hash=item3bedcdc549:g:OtQAAeSw2yNpqgWU
381,KTM PowerWear 2024 Team Softshell Jacket,KTM PowerWear 2024 Team Softshell ジャケット,mercari;yahoo,16118,https://www.ebay.com/itm/298373970448?_skw=KTM+PowerWear&hash=item4578797a10:g:k~kAAeSwfwZqHVjX
382,KTM PowerWear 2025 Kid's Red Bull Team T-Shirt KPW1XIP,KTM PowerWear 2025 Kid's Red Bull Team Tシャツ KPW1XIP,mercari;yahoo,5558,https://www.ebay.com/itm/306931933964?_skw=KTM+PowerWear&hash=item477691a30c:g:Q1QAAeSwGTpqAajW
383,KTM PowerWear Street Evo Pants,KTM PowerWear Street Evo パンツ,mercari;yahoo,35803,https://www.ebay.com/itm/298347125423?_skw=KTM+PowerWear&hash=item4576dfdaaf:g:c44AAeSwvb1qEisM
384,KTM PowerWear 2024 Red Bull Team Winter Jacket,KTM PowerWear 2024 Red Bull Team Winter ジャケット,mercari;yahoo,35803,https://www.ebay.com/itm/306971837377?_skw=KTM+PowerWear&hash=item4778f283c1:g:~6IAAeSw7jVqGrba
385,KTM PowerWear Radium V3 Jeans,KTM PowerWear Radium V3 Jeans,mercari;yahoo,33754,https://www.ebay.com/itm/298333820996?_skw=KTM+PowerWear&hash=item457614d844:g:tRwAAeSwFCdqDN3q
386,KTM Powerwear Prime Motorcycle Riding Jacket Mens S Gray Water Repellant Hooded,KTM Powerwear Prime Motorcycle Riding ジャケット Mens S Gray Water Repellant Hooded,mercari;yahoo,9298,https://www.ebay.com/itm/227192146708?_skw=KTM+PowerWear&hash=item34e5b50b14:g:8AgAAeSwl91peSfb
387,"KTM PowerWear Baby Team Romper - Black/Orange, 18-24 Months","KTM PowerWear Baby Team Romper - Black/Orange, 18-24 Months",mercari;yahoo,4765,https://www.ebay.com/itm/298389792448?_skw=KTM+PowerWear&hash=item45796ae6c0:g:IrkAAeSwvIhqI~Mg
388,KTM PowerWear 2024 Mechanic Shirt size Large/Motocross/MX/Bmx Free Shipping!,KTM PowerWear 2024 Mechanic シャツ size Large/Motocross/MX/Bmx Free Shipping!,mercari;yahoo,7748,https://www.ebay.com/itm/257392677855?_skw=KTM+PowerWear&hash=item3bedcc93df:g:mZoAAeSw5nxpqfAY
389,KTM Powerwear Racing Mens Large Black / Orange / Charcoal Sweatshirt,KTM Powerwear Racing Mens Large Black / Orange / Charcoal Sweatshirt,mercari;yahoo,4642,https://www.ebay.com/itm/336168172329?_skw=KTM+PowerWear&hash=item4e452f3b29:g:XScAAeSwc6popJeh
390,KTM Racing Powerwear Hoodie Mens Size Large Zip Up Sweatshirt Motorcross Y2K,KTM Racing Powerwear パーカー Mens Size Large Zip Up Sweatshirt Motorcross Y2K,mercari;yahoo,4648,https://www.ebay.com/itm/800046437343?_skw=KTM+PowerWear&hash=itemba467bd3df:g:0YwAAeSwisJqDkyh
391,KTM PowerWear Racetech Jacket,KTM PowerWear Racetech ジャケット,mercari;yahoo,37508,https://www.ebay.com/itm/298331964123?_skw=KTM+PowerWear&hash=item4575f882db:g:-HoAAeSwKuRqDDic
392,KTM PowerWear USWE Moto Hydro 8L Hydration Pack - Black,KTM PowerWear USWE Moto Hydro 8L Hydration Pack - Black,mercari;yahoo,25573,https://www.ebay.com/itm/298231968760?_skw=KTM+PowerWear&hash=item457002b3f8:g:ipUAAeSwisJp4LZV
393,"KTM PowerWear Baby Body Set 2-Pack Cotton Infant Onesies Newborn,Toddler 0-24 MO","KTM PowerWear Baby Body Set 2-Pack Cotton Infant Onesies Newborn,Toddler 0-24 MO",mercari;yahoo,6353,https://www.ebay.com/itm/178169824104?_skw=KTM+PowerWear&hash=item297bbfc368:g:xMUAAeSwAyNqFwy3
394,KTM PowerWear Blast XR1 Lens,KTM PowerWear Blast XR1 Lens,mercari;yahoo,3811,https://www.ebay.com/itm/298320029910?_skw=KTM+PowerWear&hash=item45754268d6:g:ya8AAeSw2wNqBu7b
395,KTM PowerWear WP Team Polo Shirt,KTM PowerWear WP Team Polo シャツ,mercari;yahoo,9213,https://www.ebay.com/itm/298354849459?_skw=KTM+PowerWear&hash=item457755b6b3:g:hxMAAeSwtmpqFW-L
396,KTM PowerWear Racetech Vest,KTM PowerWear Racetech Vest,mercari;yahoo,19528,https://www.ebay.com/itm/306958933241?_skw=KTM+PowerWear&hash=item47782d9cf9:g:KuEAAeSwPmNqEs53
397,KTM PowerWear Long Touring Underpants,KTM PowerWear Long Touring Underpants,mercari;yahoo,10166,https://www.ebay.com/itm/306958100860?_skw=KTM+PowerWear&hash=item477820e97c:g:7AcAAeSwLQ1qEioC
398,Red Bull KTM Racing Powerwear Mechanic Shirt Mens Large Short Sleeve Spellout,Red Bull KTM Racing Powerwear Mechanic シャツ Mens Large Short Sleeve Spellout,mercari;yahoo,4179,https://www.ebay.com/itm/389876849100?_skw=KTM+PowerWear&hash=item5ac67899cc:g:M-oAAeSwJfBp2ppQ
399,KTM PowerWear Corporate Shoes,KTM PowerWear Corporate Shoes,mercari;yahoo,23250,https://www.ebay.com/itm/177990542152?_skw=KTM+PowerWear&hash=item2971102348:g:N~gAAeSwdylpw3T7&amdata=enc%3AAQALAAAA8ACCtXRWQnOEpyOqnQQ8KGYP16g64sfQ8JR0XpphBeGJfsRgNIGIX%2BopQEY0jgGuV38AtuTa5%2Bur0aycZZeU4%2FRrb84GNtNWbhHFNQYXUE7PLTAzrEky8UJox6FSEn0TseUA8MVqRq9xGf5dRrU4FqIMeoVv9TYHacVt1Dz6I7WK0EStazTbjCm9V01o3R2HTVlF1jGNtlE4cHmukG6Imtoi5EvLeJjBFQx1SHb9OgNgeWcW5ud3Jru%2B%2F94ktyL%2B%2BIkczTmUYbA1t7jGseaa3jR7urQ8kgeFi2Hf%2BDmkSPDXHFcPM4IQFx%2B%2Ftqm98cxtzA%3D%3D
400,KTM PowerWear 2021 Rain Jacket - Small,KTM PowerWear 2021 Rain ジャケット - Small,mercari;yahoo,6200,https://www.ebay.com/itm/397658819496?_skw=KTM+PowerWear&hash=item5c96500ba8:g:JQQAAeSwkyxpokyh&amdata=enc%3AAQALAAAA8ACCtXRWQnOEpyOqnQQ8KGahQPNXzufiOEG9o2JpccqGXhKTdjf3asRzVANtTI%2Fxq%2BIaSMclaQTJYStrEGtZh3IycIJiOYEjN1EZWXgKLVpyx81%2F86p4e4AnXqp5qpVaJxmZ8RMUXDcabpfrBtxK%2Bnunm2l1r8HLcK3hJcJ0liKFh81sJA7WrRjexYKzQ0rJYYSlEE1KXt7BLR%2FY3FgnIYHUhbVHIbTE%2FqEHBWQvrNmFEaC%2FeUjTT6GNg6zDMLvdiA0PUJSZxfds4rWGomiLjPecLaNjtkucETnzfLMVw5vWd20qggWF8U4iolkDzxTlPg%3D%3D
